{
  "$schema": "http://json-schema.org/draft-07/schema#",
  "$id": "continuityops/alert.schema.json",
  "type": "object",
  "required": ["schema_version", "alert_id", "severity", "owner", "runbook", "expression"],
  "properties": {
    "schema_version": { "type": "string" },
    "alert_id": { "type": "string" },
    "severity": { "type": "string" },
    "owner": { "type": "string" },
    "runbook": { "type": "string" },
    "expression": { "type": "object" },
    "for": { "type": "string" },
    "labels": { "type": "object" },
    "annotations": { "type": "object" },
    "negative_tests": { "type": "object" }
  }
}
